No,Keyword,Search Volume,CPC,Paid Difficulty
1,"ui/ux design services","1,900","$4.71","23"
2,"interactive user experiences","50","$1.83","13"
3,"user-centered interface design","10","$0.00","2"
4,"ui ux design companies","2,400","$2.54","20"
5,"difference between ui and ux designer","1,900","$2.65","8"
6,"ui ux design companies in bangalore","390","$0.82","31"
7,"ui ux design companies in india","260","$0.65","28"
8,"ui ux design companies in chennai","170","$0.50","34"
9,"user centered design vs design thinking","170","$3.98","4"
10,"ui ux design companies in usa","140","$5.89","48"
11,"ui ux design companies in pune","110","$0.54","28"
12,"ui ux design companies in hyderabad","90","$0.61","27"
13,"examine user experiences in your life","90","$0.00","1"
14,"ui vs ux designer salary","70","$6.29","7"
15,"user interface vs user experience design","70","$2.09","17"
16,"ux or ui which is better","50","$3.52","14"
17,"like user","50","$0.00","1"
18,"example of good user experience","50","$0.00","3"
19,"user experience vs interaction design","40","$0.00","6"
20,"ui ux design companies in dubai","30","$4.80","52"
21,"user experience requirements examples","30","$0.00","1"
22,"ux vs ui vs graphic design","20","$0.00","3"
23,"zee frames ui ux design services","0","$0.00","1"
24,"user centered design ui ux","0","$0.00","1"
25,"user interface centred design","0","$0.00","1"
26,"user settings ux","0","$0.00","1"
27,"designing user support systems in hci","0","$0.00","1"
28,"user interaction and experience","0","$0.00","1"
29,"interactive activities in dallas","0","$0.00","1"
30,"user interaction vs user experience","0","$0.00","1"
