No,Keyword,Search Volume,CPC,Paid Difficulty
1,"ui/ux design services","1,900","$4.71","23"
2,"interactive user experiences","50","$1.83","13"
3,"user-centered interface design","10","$0.00","2"
4,"what is user interface design","1,600","$1.60","5"
5,"what is user centered design","1,000","$1.00","1"
6,"user interface design principles","1,000","$1.45","6"
7,"types of menus in user interface design","40","$0.00","1"
8,"user interactive elements","30","$0.00","1"
9,"non interactive user","30","$0.00","1"
10,"non interactive user dynamics 365","30","$0.00","4"
11,"use interactive login error in uipath","0","$0.00","1"
12,"non interactive user account in windows","0","$0.00","1"
13,"non interactive user servicenow","0","$0.00","1"
