No,Keyword,Search Volume,CPC,Paid Difficulty
1,"mobile app development","33,100","$5.29","33"
2,"ios & android development","0","$0.00","1"
3,"Cross-Platform App Development","_","_","_"
4,"web and mobile app development","720","$3.98","24"
5,"develop app without coding","480","$4.35","50"
6,"introduction to mobile application development","480","$1.01","8"
7,"mobile app developers near me","390","$15.40","39"
8,"java for mobile app development","210","$2.34","16"
9,"roadmap for mobile app development","140","$0.73","10"
10,"flutter for mobile app development","140","$2.62","32"
11,"future of mobile app development","140","$2.43","6"
12,"develop ios app without mac","140","$4.29","8"
13,"ios development without mac","140","$3.89","2"
14,"develop android app without coding","110","$1.37","46"
15,"angular for mobile app development","90","$4.51","19"
16,"introduction to mobile application development pdf","70","$0.00","5"
17,"introduction to mobile application development ppt","70","$1.59","6"
18,"developing apps for both ios and android","70","$4.86","32"
19,"best framework for cross platform app development","50","$2.69","19"
20,"which is best for android app development","50","$1.13","24"
21,"introduction to mobile app development","40","$2.12","15"
22,"laptop for mobile app development","30","$0.61","100"
23,"near mobile data","30","$5.38","7"
24,"roadmap to mobile app development","30","$1.45","13"
25,"best framework for cross platform mobile development","30","$2.74","21"
26,"ios and android programming language","30","$0.00","5"
27,"phone app developer near me","20","$18.22","51"
28,"guide to mobile app development","20","$0.00","14"
29,"introduction to mobile application development notes","20","$1.00","6"
30,"mobile and application development mcqs","20","$0.00","1"
31,"best language for cross platform app development","20","$0.00","4"
32,"android ios app development framework","20","$2.90","11"
33,"is ios development harder than android","20","$0.00","1"
34,"framework for ios and android development","20","$5.07","23"
35,"android development for ios developers","20","$8.04","31"
36,"android development or ios development","20","$0.00","11"
37,"ios and android developer salary","20","$0.00","1"
38,"how to use android and ios together","20","$0.00","2"
39,"is mobile app development easy","0","$0.00","1"
40,"is mobile app development dying","0","$0.00","1"
41,"is mobile app development a software","0","$0.00","1"
42,"a mobile app development","0","$0.00","1"
43,"to mobile app development","0","$0.00","1"
44,"steps to mobile app development","0","$0.00","1"
45,"approaches to mobile app development","0","$0.00","1"
46,"challenges to mobile app development","0","$0.00","1"
47,"learn to mobile app development","0","$0.00","1"
48,"companies with mobile app development","0","$0.00","1"
49,"disadvantages of cross platform app development","0","$0.00","1"
50,"future of cross platform app development","0","$0.00","1"
51,"ios or android development for beginners","0","$0.00","1"
52,"ios and android developer job scope","0","$0.00","1"
53,"ios and android developer salary malaysia","0","$0.00","1"
54,"is android or ios development easier","0","$0.00","1"
