No,Keyword,Search Volume,CPC,Paid Difficulty
1,"custom software development","3,600","$18.56","14"
2,"innovative software solutions","480","$4.37","7"
3,"tailored business software","0","$0.00","1"
4,"tailored solution","1,000","$3.40","1"
5,"tailor made software","880","$3.96","4"
6,"bespoke software development company","390","$32.70","22"
7,"custom software engineering analyst","320","$2.14","1"
8,"custom software development agency","210","$26.28","34"
9,"custom software engineering associate","210","$1.56","2"
10,"best custom software development companies","210","$22.23","21"
11,"innovative solutions examples","210","$2.18","2"
12,"custom erp software development","170","$23.18","28"
13,"innova solutions salary","170","$0.00","1"
14,"customer software development","140","$22.16","22"
15,"creative software solutions","140","$5.81","8"
16,"zon innovative it solutions pvt ltd","110","$0.00","1"
17,"custom software development company in chennai","90","$0.00","3"
18,"custom software engineering analyst accenture salary","90","$0.00","1"
19,"custom software engineering associate accenture","90","$0.00","7"
20,"custom financial software development","90","$10.46","14"
21,"custom software development price","90","$12.09","25"
22,"custom software development blogs","70","$3.74","13"
23,"custom software development companies uk","70","$26.57","57"
24,"innova software solutions","70","$9.75","3"
25,"innovative iteration software solutions","70","$0.00","1"
26,"infinire innovative software solutions","70","$0.00","1"
27,"innova solutions usa","70","$3.66","3"
28,"business software comparison","70","$7.18","21"
29,"tailor made software meaning","70","$0.00","1"
30,"top 10 custom software development companies","50","$46.12","21"
31,"binmile technologies custom software development company","50","$0.00","1"
32,"innovative solutions hyderabad","50","$0.00","1"
33,"innovative 3d solutions","50","$1.95","3"
34,"creative solutions software accounting","50","$11.69","31"
35,"honest software solutions","50","$0.00","1"
36,"iss innovative software services gmbh","50","$0.00","1"
37,"tailoring software price list","50","$0.20","17"
38,"tailoring software for cutting","50","$0.20","19"
39,"tailorsoft","50","$0.00","1"
40,"custom software engineering specialist","40","$12.05","12"
41,"custom software engineering analyst salary","40","$0.00","1"
42,"innovative 3d printing solutions","40","$0.82","21"
43,"creative solutions software corp","40","$11.85","6"
44,"innovative solutions jobs","40","$0.00","6"
45,"easy innovation system solutions","40","$0.00","1"
46,"tailoring software free","40","$0.88","17"
47,"tailored solutions pvt ltd","40","$0.00","1"
48,"custom software development market","30","$9.61","23"
49,"custom software development brisbane","30","$12.76","33"
50,"custom software development in houston","30","$28.15","14"
51,"custom application development in servicenow","30","$13.76","15"
52,"custom software development raleigh","30","$0.00","1"
53,"custom software development trends","30","$3.70","16"
54,"custom software development companies in canada","20","$5.02","73"
55,"custom software development services market","20","$21.75","14"
56,"custom software development definition","20","$0.00","1"
57,"custom software development provider","20","$16.84","23"
58,"custom software product development company","20","$0.00","3"
59,"custom software development services in india","20","$0.00","1"
60,"custom application development servicenow","20","$4.57","14"
61,"makeen custom software development & technology services","20","$0.00","3"
62,"custom software development agreement template","20","$3.82","77"
63,"innovative it solutions peenya","20","$0.00","1"
64,"innovative solutions ahmedabad","20","$0.00","1"
65,"young innovative it solutions pvt ltd","20","$0.00","1"
66,"re innovative software solutions","20","$3.62","27"
67,"innovative ideas for hr department","20","$1.67","18"
68,"business software cost","20","$4.89","20"
69,"what is a tailored software","20","$0.00","1"
70,"custom software engineering associate salary","10","$0.00","1"
71,"custom software development hourly rate","10","$12.90","35"
72,"custom software development houston tx","10","$0.00","7"
73,"custom software engineering team lead","10","$0.00","1"
74,"bespoke software development meaning","10","$0.00","4"
75,"custom software is the most affordable systems development option","10","$0.00","1"
76,"custom software development proposal template","10","$4.39","51"
77,"custom software development phoenix az","10","$0.00","1"
78,"custom software development services companies","10","$0.00","36"
79,"custom software development utah","10","$0.00","40"
80,"innovative it solutions bangalore","10","$0.00","1"
81,"creative software consultancy services","10","$0.00","1"
82,"innovative it solutions guyana","10","$0.00","4"
83,"innovative software services inc","10","$4.55","8"
84,"nsm software and innovative solutions inc","10","$0.00","1"
85,"custom software development services gartner","0","$0.00","1"
86,"custom software development statistics","0","$0.00","1"
87,"5 advantages of custom software development","0","$0.00","1"
88,"custom software engineering associate accenture salary","0","$0.00","1"
89,"custom software engineering analyst means","0","$0.00","1"
90,"custom software engineering associate manager","0","$0.00","1"
91,"custom software engineering associate manager accenture","0","$0.00","1"
92,"custom software engineering assoc manager","0","$0.00","1"
93,"custom software engineering analyst level in accenture","0","$0.00","1"
94,"custom software development big companies","0","$0.00","1"
95,"custom software development book","0","$0.00","1"
96,"bespoke software development benefits","0","$0.00","1"
97,"custom software development company binaryfolks","0","$0.00","1"
98,"custom software development company hyderabad","0","$0.00","1"
99,"custom software development cronj","0","$0.00","1"
100,"bespoke software development change","0","$0.00","1"
101,"custom software engineering definition","0","$0.00","1"
102,"custom software product development definition","0","$0.00","1"
103,"disadvantages custom software development","0","$0.00","1"
104,"custom software development and web development","0","$0.00","1"
105,"custom application development example","0","$0.00","1"
106,"custom software development in erode","0","$0.00","1"
107,"custom software development en español","0","$0.00","1"
108,"custom software development en francais","0","$0.00","1"
109,"custom software development que es","0","$0.00","1"
110,"magic quadrant for custom software development services worldwide","0","$0.00","1"
111,"custom software development traduction francais","0","$0.00","1"
112,"custom software development gartner","0","$0.00","1"
113,"good custom software development companies","0","$0.00","1"
114,"gartner magic quadrant custom software development","0","$0.00","1"
115,"custom software development перевод","0","$0.00","1"
116,"custom application development in hyderabad","0","$0.00","1"
117,"custom software development in uk","0","$0.00","1"
118,"custom software development ideas","0","$0.00","1"
119,"custom software engineering in accenture","0","$0.00","1"
120,"custom software engineering specialist job description","0","$0.00","1"
121,"custom visual software development kit","0","$0.00","1"
122,"custom software engineering analyst level","0","$0.00","1"
123,"custom software engineering manager","0","$0.00","1"
124,"custom software engineering manager accenture","0","$0.00","1"
125,"custom software engineering manager accenture salary","0","$0.00","1"
126,"custom software engineering means","0","$0.00","1"
127,"custom software engineering associate meaning","0","$0.00","1"
128,"custom software development services worldwide magic quadrant","0","$0.00","1"
129,"custom software development naics","0","$0.00","1"
130,"angry nerds custom software development company","0","$0.00","1"
131,"custom software development portland oregon","0","$0.00","1"
132,"snf custom application development overview knowledge check","0","$0.00","1"
133,"our custom software development","0","$0.00","1"
134,"custom software development product","0","$0.00","1"
135,"bespoke software development projects","0","$0.00","1"
136,"custom application development problems","0","$0.00","1"
137,"bespoke software product development","0","$0.00","1"
138,"custom software development requirement","0","$0.00","1"
139,"custom software engineering associate roles and responsibilities","0","$0.00","1"
140,"custom software engineering senior analyst accenture salary","0","$0.00","1"
141,"custom software engineering specialist accenture salary","0","$0.00","1"
142,"custom software engineering senior analyst accenture","0","$0.00","1"
143,"bespoke software development work","0","$0.00","1"
144,"innovative solutions zoominfo","0","$0.00","1"
145,"innovative solutions zauba","0","$0.00","1"
146,"innovative it solutions contact details","0","$0.00","1"
147,"innovation software and services company llc","0","$0.00","1"
148,"innovative software services inc dublin ohio","0","$0.00","1"
149,"innovative it solutions examples","0","$0.00","1"
150,"innovate software solutions pvt ltd email address","0","$0.00","1"
151,"edios innovative software solutions","0","$0.00","1"
152,"innovative software package solution for hotels","0","$0.00","1"
153,"iss innovative software services gmbh linkedin","0","$0.00","1"
154,"innovative it solutions in marathahalli","0","$0.00","1"
155,"issi innovative software solutions","0","$0.00","1"
156,"infinire innovative software solutions linkedin","0","$0.00","1"
157,"innovative software solutions kft","0","$0.00","1"
158,"kuhnert innovative software solutions","0","$0.00","1"
159,"innovative it solutions llc","0","$0.00","1"
160,"creative software solutions llc","0","$0.00","1"
161,"innovative it solutions pvt ltd","0","$0.00","1"
162,"creative compliance software solutions llc","0","$0.00","1"
163,"avanza innovations it solutions llc","0","$0.00","1"
164,"innovative it solutions mumbai","0","$0.00","1"
165,"innovative mark it solutions nj","0","$0.00","1"
166,"creative pills software solutions private limited","0","$0.00","1"
167,"zon innovative it solutions pvt ltd reviews","0","$0.00","1"
168,"innova solutions quora","0","$0.00","1"
169,"innovative software package solution to help manage the customer base","0","$0.00","1"
170,"innovative wings software solutions","0","$0.00","1"
171,"ko innovation software solutions zauba","0","$0.00","1"
