No,Keyword,Search Volume,CPC,Paid Difficulty
437,"social media marketing 4th edition tuten pdf free","40","$0.00","1"
438,"social media campaign brief example","40","$2.24","18"
439,"social media campaign budget template","40","$2.81","14"
440,"social media campaign calendar template","40","$5.21","30"
441,"social media campaign proposal example","40","$0.00","5"
442,"social media campaign proposal pdf","40","$1.57","8"
443,"social media campaign template free","40","$2.89","28"
444,"social media marketing vocabulary","40","$2.15","14"
445,"social media marketing volunteer","40","$4.30","34"
446,"social media marketing variables","40","$1.32","8"
447,"social media marketing workbook 2023 pdf","40","$1.45","28"
448,"social media marketing workbook pdf","40","$0.61","11"
449,"social media marketing workbook 2022 pdf","40","$0.00","6"
450,"social media marketing generation z","40","$3.26","12"
451,"digital marketing for financial services summit 2023","30","$6.12","22"
452,"digital marketing services for business","30","$2.67","48"
453,"digital marketing services captions","30","$0.76","16"
454,"digital marketing agency earnings","30","$1.43","18"
455,"digital marketing agency examples","30","$1.22","23"
456,"digital marketing agency goals","30","$0.73","20"
457,"digital marketing services hashtags","30","$0.00","5"
458,"digital marketing agency html template","30","$0.56","25"
459,"digital marketing agency jobs remote","30","$1.77","37"
460,"digital marketing agency jobs in mumbai","30","$0.20","30"
461,"digital marketing services name","30","$1.11","25"
462,"digital marketing services offer","30","$4.25","20"
463,"digital marketing services proposal pdf","30","$2.94","31"
464,"digital marketing services reviews","30","$3.67","10"
465,"digital marketing agency upwork","30","$6.27","17"
466,"digital marketing agency video template","30","$1.29","47"
467,"digital marketing agency what they do","30","$3.28","19"
468,"digital marketing agency worldwide","30","$2.39","43"
469,"digital marketing agency youtube","30","$1.19","33"
470,"social media marketing 2022 pdf","30","$0.00","2"
471,"social media marketing 4th edition","30","$0.00","71"
472,"social media campaign results","30","$1.66","19"
473,"social media campaign effectiveness","30","$3.22","16"
474,"social media campaigns for small business","30","$5.40","41"
475,"social media marketing key points","30","$3.09","21"
476,"social media marketing linkedin profile","30","$0.00","7"
477,"social media campaign outline","30","$3.98","25"
478,"social media campaign presentation template","30","$1.81","28"
479,"social media campaign report pdf","30","$0.00","6"
480,"social media campaigns strategies for public relations and marketing","30","$2.76","20"
481,"social media campaign types","30","$3.39","7"
482,"social media campaign template word","30","$4.40","33"
483,"social media campaign timeline example","30","$2.50","13"
484,"social media marketing university courses","30","$2.96","65"
485,"social media marketing using facebook","30","$3.68","37"
486,"social media campaign video","30","$7.43","14"
487,"social media marketing video free download","30","$0.00","13"
488,"social media marketing york","30","$6.66","40"
489,"social media marketing zulqarnain bharwana","30","$0.00","1"
490,"digital marketing company top 10","20","$2.08","21"
491,"digital marketing agency 2022","20","$0.00","1"
492,"digital marketing services benefits","20","$0.00","14"
493,"digital marketing agency elite consultants masterclass","20","$0.00","5"
494,"digital marketing services flyer","20","$0.00","10"
495,"digital marketing services gif","20","$0.00","1"
496,"digital marketing agency jobs in dubai","20","$0.78","53"
497,"digital marketing services landing page","20","$1.13","43"
498,"digital marketing service level agreement template","20","$2.38","41"
499,"digital marketing services presentation","20","$1.83","22"
500,"digital marketing services pelham al","20","$8.99","25"
501,"digital marketing agency interview questions","20","$0.00","3"
502,"digital marketing agency in quebec city","20","$3.42","88"
503,"digital marketing services to offer","20","$5.31","32"
504,"digital marketing services tagline","20","$3.07","21"
505,"digital marketing services vector","20","$0.00","1"
506,"digital marketing agency in yangon","20","$2.06","12"
507,"social media campaigns to increase followers","20","$2.92","40"
508,"social media campaign schedule","20","$8.58","48"
509,"social media campaigns 2020","20","$0.00","1"
510,"social media marketing 2020","20","$3.39","15"
511,"social media marketing 3rd edition pdf free","20","$0.00","6"
512,"social media marketing 3rd edition","20","$0.00","60"
513,"social media marketing 360","20","$0.00","22"
514,"social media marketing 4th edition tuten pdf","20","$0.00","14"
515,"social media campaign contoh","20","$0.00","1"
516,"social media campaign deliverables","20","$3.31","27"
517,"social media campaign deck","20","$3.14","21"
518,"social media campaign environment","20","$0.00","1"
519,"social media campaign elements","20","$0.00","4"
520,"social media campaign examples 2020","20","$0.00","1"
521,"social media campaigns gone wrong","20","$0.00","1"
522,"social media campaign jobs","20","$1.01","18"
523,"social media marketing ke labh","20","$0.00","1"
524,"social media campaign names","20","$0.00","4"
525,"social media campaign process","20","$2.81","12"
526,"social media campaign portfolio","20","$4.70","14"
527,"social media campaign report sample","20","$3.98","26"
528,"social media campaign template ppt","20","$4.85","22"
529,"social media campaign topics","20","$0.00","1"
530,"social media marketing upwork proposal","20","$0.00","21"
531,"social media marketing course youtube","20","$3.67","12"
532,"social media marketing zones","20","$0.00","7"
533,"social media marketing zimbabwe","20","$0.00","17"
534,"social media marketing of zomato","20","$0.00","1"
535,"online branding pdf","20","$0.00","43"
536,"nttcom online marketing solutions corporation","20","$0.00","1"
537,"digital marketing for financial services summit 2022","10","$0.00","18"
538,"digital marketing agency 360i","10","$0.00","1"
539,"7 digital marketing services","10","$0.00","19"
540,"digital marketing agency 99designs","10","$0.00","28"
541,"digital marketing services contract template","10","$3.78","53"
542,"digital marketing agency ernakulam","10","$0.59","21"
543,"digital marketing agency explained","10","$0.00","17"
544,"digital marketing agency gujranwala","10","$0.00","5"
545,"digital marketing agency gwalior","10","$0.66","8"
546,"digital marketing services in san francisco","10","$11.82","30"
547,"digital marketing services naics code","10","$0.00","1"
548,"digital marketing services orlando fl","10","$0.00","21"
549,"digital marketing services quora","10","$0.00","1"
550,"internet marketing company utah","10","$0.00","32"
551,"social media marketing 12","10","$0.00","1"
552,"social media marketing 191","10","$0.00","1"
553,"social media marketing chapter 1 quizlet","10","$0.00","1"
554,"social media marketing 2023 pdf","10","$1.09","17"
555,"social media marketing 2022 book","10","$0.00","1"
556,"social media marketing 3rd edition ebook","10","$3.72","50"
557,"social media marketing chapter 3","10","$0.00","1"
558,"social media marketing chapter 4 quizlet","10","$0.00","28"
559,"social media marketing tuten 4th edition","10","$0.00","50"
560,"social media marketing chapter 5 quizlet","10","$0.00","1"
561,"social media marketing chapter 6 quizlet","10","$0.00","1"
562,"social media marketing chapter 8 quizlet","10","$0.00","1"
563,"social media campaign best practices","10","$2.30","21"
564,"social media campaigns cannot be easily automated","10","$0.00","1"
565,"social media campaign generator","10","$3.74","61"
566,"social media marketing key skills","10","$3.51","11"
567,"social media campaign name ideas","10","$0.00","4"
568,"social media campaigns strategies for public relations and marketing pdf","10","$0.00","11"
569,"social media campaign starbucks","10","$0.00","1"
570,"social media marketing york pa","10","$0.00","1"
571,"social media campaign for youth empowerment","10","$0.00","43"
572,"dove social media campaign you are so beautiful","10","$0.00","2"
573,"360 branding solutions pvt ltd","10","$0.00","1"
574,"dlp online marketing solutions pvt ltd","10","$0.00","8"
575,"digital marketing services in chishtian","0","$0.00","1"
576,"digital marketing services facebook","0","$0.00","1"
577,"digital marketing agency 2009","0","$0.00","1"
578,"and 27 digital marketing services","0","$0.00","1"
579,"digital marketing services means","0","$0.00","1"
580,"digital marketing agency fortune 500","0","$0.00","1"
581,"digital marketing services affiliate program","0","$0.00","1"
582,"digital marketing services business plan","0","$0.00","1"
583,"digital marketing services brands","0","$0.00","1"
584,"digital marketing services buffalo ny","0","$0.00","1"
585,"digital marketing services cost in india","0","$0.00","1"
586,"digital marketing services creative ads","0","$0.00","1"
587,"digital marketing agency entry level jobs","0","$0.00","1"
588,"digital marketing company earnings","0","$0.00","1"
589,"digital marketing services fiverr","0","$0.00","1"
590,"digital marketing services freelancers","0","$0.00","1"
591,"digital marketing services growth","0","$0.00","1"
592,"digital marketing service group","0","$0.00","1"
593,"digital marketing agency gujarat","0","$0.00","1"
594,"digital marketing services hiring","0","$0.00","1"
595,"digital marketing agency headlines","0","$0.00","1"
596,"digital marketing agency html template free","0","$0.00","1"
597,"digital marketing services in multan","0","$0.00","1"
598,"digital marketing services keyword list","0","$0.00","1"
599,"digital marketing service level agreement","0","$0.00","1"
600,"digital marketing services nashik","0","$0.00","1"
601,"digital marketing company objectives","0","$0.00","1"
602,"digital marketing services post design","0","$0.00","1"
603,"digital marketing agency questions","0","$0.00","1"
604,"digital marketing services r slogan","0","$0.00","1"
605,"digital marketing services raipur","0","$0.00","1"
606,"digital marketing services role","0","$0.00","1"
607,"digital marketing services ranking","0","$0.00","1"
608,"digital marketing services slogans","0","$0.00","1"
609,"digital marketing services selling","0","$0.00","1"
610,"digital marketing services types","0","$0.00","1"
611,"digital marketing services testimonials","0","$0.00","1"
612,"digital marketing services tds","0","$0.00","1"
613,"digital marketing agency udemy","0","$0.00","1"
614,"digital marketing agency up","0","$0.00","1"
615,"digital marketing services videos","0","$0.00","1"
616,"digital marketing agency valuation multiples uk","0","$0.00","1"
617,"digital marketing company values","0","$0.00","1"
618,"digital marketing agency vacancy","0","$0.00","1"
619,"digital marketing company yangon","0","$0.00","1"
620,"digital marketing agency in yaba","0","$0.00","1"
621,"digital marketing company in york","0","$0.00","1"
622,"digital marketing agency in yaba lagos","0","$0.00","1"
623,"digital marketing in financial services new york","0","$0.00","1"
624,"digital marketing agency zimbabwe","0","$0.00","1"
625,"digital marketing service providers in zimbabwe","0","$0.00","1"
626,"social media campaigns for pride month","0","$0.00","1"
627,"social media campaigns can live","0","$0.00","1"
628,"social media marketing 001","0","$0.00","1"
629,"social media campaign 101","0","$0.00","1"
630,"social media campaign top 10","0","$0.00","1"
631,"social media marketing chapter 10 quizlet","0","$0.00","1"
632,"social media marketing chapter 11 quizlet","0","$0.00","1"
633,"social media marketing chapter 12 quizlet","0","$0.00","1"
634,"social media marketing chapter 1","0","$0.00","1"
635,"social media marketing chapter 1 quiz","0","$0.00","1"
636,"social media marketing 2022 statistics","0","$0.00","1"
637,"social media marketing 2nd edition barker","0","$0.00","1"
638,"social media marketing 3rd ed","0","$0.00","1"
639,"social media marketing chapter 3 quiz","0","$0.00","1"
640,"social media marketing tips 3","0","$0.00","1"
641,"social media marketing in 5 minutes","0","$0.00","1"
642,"social media marketing chapter 5 quiz","0","$0.00","1"
643,"social media marketing top 5","0","$0.00","1"
644,"social media marketing chapter 6 quiz","0","$0.00","1"
645,"7 inspirational social media campaigns","0","$0.00","1"
646,"social media marketing chapter 9 quiz","0","$0.00","1"
647,"social media campaigns about mental health","0","$0.00","1"
648,"social media campaigns about","0","$0.00","1"
649,"social media campaigns benefits","0","$0.00","1"
650,"social media campaign build","0","$0.00","1"
651,"social media campaigns change","0","$0.00","1"
652,"social media campaign climate change","0","$0.00","1"
653,"social media campaign coca cola","0","$0.00","1"
654,"social media campaign diabetes","0","$0.00","1"
655,"social media campaign donation","0","$0.00","1"
656,"social media campaigns examples 2023","0","$0.00","1"
657,"social media campaigns examples 2022","0","$0.00","1"
658,"social media campaigns engagement","0","$0.00","1"
659,"social media campaigns evaluation","0","$0.00","1"
660,"social media campaign examples pdf","0","$0.00","1"
661,"social media campaign evaluation template","0","$0.00","1"
662,"social media campaigns for charitable organizations","0","$0.00","1"
663,"social media campaigns for climate change","0","$0.00","1"
664,"social media campaigns for healthcare","0","$0.00","1"
665,"social media campaigns for b2b","0","$0.00","1"
666,"social media campaigns graphics","0","$0.00","1"
667,"social media campaigns goals","0","$0.00","1"
668,"social media campaigns gaming","0","$0.00","1"
669,"social media campaign giveaways","0","$0.00","1"
670,"social media campaign growth","0","$0.00","1"
671,"social media campaign setup","0","$0.00","1"
672,"social media campaigns health","0","$0.00","1"
673,"social media campaigns how to create","0","$0.00","1"
674,"social media campaign health promotion","0","$0.00","1"
675,"social media campaign how","0","$0.00","1"
676,"social media campaign how it works","0","$0.00","1"
677,"social media campaigns job description","0","$0.00","1"
678,"social media campaign knowledge sharing","0","$0.00","1"
679,"social media marketing kya h in hindi","0","$0.00","1"
680,"social media campaigns logo","0","$0.00","1"
681,"social media campaigns leadership","0","$0.00","1"
682,"social media campaign lesson plan","0","$0.00","1"
683,"social media campaign littering","0","$0.00","1"
684,"social media campaign learning","0","$0.00","1"
685,"social media campaigns mental health","0","$0.00","1"
686,"social media campaign newspaper","0","$0.00","1"
687,"social media campaigns new","0","$0.00","1"
688,"social media campaign nike","0","$0.00","1"
689,"social media campaign ngo","0","$0.00","1"
690,"social media campaign new product","0","$0.00","1"
691,"social media campaign nursing","0","$0.00","1"
692,"social media campaign nsw","0","$0.00","1"
693,"social media campaigns of 2022","0","$0.00","1"
694,"social media campaign of nike","0","$0.00","1"
695,"social media campaign on mental health","0","$0.00","1"
696,"social media campaign pitch example","0","$0.00","1"
697,"social media campaign pitch deck","0","$0.00","1"
698,"social media campaign questions","0","$0.00","1"
699,"social media campaign quora","0","$0.00","1"
700,"social media campaigns research quizlet","0","$0.00","1"
701,"social media campaigns research","0","$0.00","1"
702,"social media campaigns right now","0","$0.00","1"
703,"social media campaigns resume","0","$0.00","1"
704,"social media campaigns recommendations","0","$0.00","1"
705,"social media campaigns refugees","0","$0.00","1"
706,"social media campaign rubric","0","$0.00","1"
707,"social media campaign review","0","$0.00","1"
708,"social media campaign roles","0","$0.00","1"
709,"social media campaign roi formula","0","$0.00","1"
710,"social media campaign requirements","0","$0.00","1"
711,"social media campaign start","0","$0.00","1"
712,"social media campaign to launch","0","$0.00","1"
713,"social media campaign to","0","$0.00","1"
714,"social media campaign using facebook","0","$0.00","1"
715,"social media campaign in","0","$0.00","1"
716,"social media campaigns video game","0","$0.00","1"
717,"social media campaign visual","0","$0.00","1"
718,"social media campaign violence","0","$0.00","1"
719,"social media campaigns what is","0","$0.00","1"
720,"social media campaign wgu","0","$0.00","1"
721,"social media campaign what to do","0","$0.00","1"
722,"social media marketing generation x","0","$0.00","1"
723,"social media campaign youtube","0","$0.00","1"
724,"social media marketing yoga","0","$0.00","1"
725,"social media marketing youtube tips","0","$0.00","1"
726,"social media marketing yearly","0","$0.00","1"
727,"dove social media campaign youtube","0","$0.00","1"
728,"social media marketing in zimbabwe pdf","0","$0.00","1"
729,"social media marketing agency zimbabwe","0","$0.00","1"
730,"social media marketing new zealand jobs","0","$0.00","1"
731,"social media marketing course zurich","0","$0.00","1"
732,"zara social media campaigns","0","$0.00","1"
733,"examples of online branding","0","$0.00","1"
734,"catalyst design retail and online branding solutions llp","0","$0.00","1"
735,"leol online marketing solutions llc","0","$0.00","1"
