No,Keyword,Search Volume,CPC,Paid Difficulty
1,"digital marketing services","33,100","$3.68","21"
2,"social media campaigns","12,100","$4.01","14"
3,"online branding solutions","140","$3.04","19"
4,"social media marketing agency","27,100","$3.98","39"
5,"social media marketing course","22,200","$2.92","55"
6,"social media marketing strategy","14,800","$2.05","19"
7,"digital marketing agency near me","12,100","$5.49","9"
8,"social media marketing jobs","12,100","$1.42","23"
9,"digital marketing agency dubai","6,600","$3.47","49"
10,"digital marketing agency delhi","6,600","$0.70","38"
11,"digital marketing agency mumbai","5,400","$0.80","36"
12,"digital marketing agency us","5,400","$2.93","56"
13,"social media marketing business","5,400","$5.82","16"
14,"social media marketing examples","5,400","$1.31","12"
15,"digital marketing company near me","4,400","$7.93","13"
16,"social media marketing course free","4,400","$1.49","48"
17,"social media marketing definition","3,600","$0.83","6"
18,"social media marketing job description","3,600","$1.54","10"
19,"social media marketing meaning","3,600","$0.69","5"
20,"social media marketing manager","3,600","$4.88","34"
21,"social media marketing salary","3,600","$1.92","3"
22,"digital marketing agency ahmedabad","2,900","$0.49","23"
23,"digital marketing agency hyderabad","2,900","$0.78","28"
24,"digital marketing agency kolkata","2,900","$0.61","25"
25,"digital marketing agency uk","2,900","$3.02","46"
26,"social media marketing advantages","2,900","$1.21","5"
27,"social media marketing online course","2,900","$5.32","46"
28,"digital marketing company ahmedabad","2,400","$0.48","17"
29,"digital marketing company hyderabad","2,400","$0.76","28"
30,"digital marketing agency noida","2,400","$0.77","30"
31,"digital marketing agency new york","2,400","$4.57","43"
32,"digital marketing company noida","2,400","$0.75","20"
33,"social media marketing books","2,400","$4.73","100"
34,"social media marketing internship","2,400","$3.07","21"
35,"social media marketing quotes","2,400","$3.84","4"
36,"social media marketing uses","2,400","$2.84","13"
37,"digital marketing agency australia","1,900","$4.50","51"
38,"digital marketing agency toronto","1,900","$6.99","46"
39,"digital marketing company us","1,900","$3.48","53"
40,"social media marketing cost","1,900","$3.70","28"
41,"social media marketing introduction","1,900","$2.35","14"
42,"social media marketing near me","1,900","$7.32","23"
43,"digital marketing agency gurgaon","1,600","$0.93","31"
44,"digital marketing company london","1,600","$4.95","36"
45,"digital marketing agency melbourne","1,600","$6.96","36"
46,"digital marketing agency singapore","1,600","$5.86","56"
47,"digital marketing agency website","1,600","$1.02","48"
48,"social media marketing advantages and disadvantages","1,600","$1.53","2"
49,"social media marketing articles","1,600","$1.56","19"
50,"social media marketing blogs","1,600","$1.85","22"
51,"social media marketing disadvantages","1,600","$2.50","1"
52,"social media marketing ideas","1,600","$2.64","28"
53,"social media marketing images","1,600","$2.88","1"
54,"social media marketing on facebook","1,600","$4.63","27"
55,"social media marketing statistics","1,600","$2.62","10"
56,"digital marketing agency jaipur","1,300","$0.42","19"
57,"digital marketing company kochi","1,300","$0.60","15"
58,"digital marketing agency los angeles","1,300","$6.02","35"
59,"digital marketing agency manchester","1,300","$4.84","37"
60,"digital marketing agency surat","1,300","$0.38","17"
61,"social media marketing diploma","1,300","$4.42","48"
62,"social media marketing interview questions","1,300","$0.41","3"
63,"social media marketing icon","1,300","$3.54","2"
64,"social media marketing logo","1,300","$3.31","3"
65,"social media marketing strategy example","1,300","$2.55","26"
66,"social media marketing specialist","1,300","$3.62","21"
67,"digital marketing agency dallas","1,000","$7.99","19"
68,"digital marketing agency karachi","1,000","$1.03","16"
69,"digital marketing company kerala","1,000","$0.73","11"
70,"digital marketing agency lucknow","1,000","$0.70","14"
71,"digital marketing agency miami","1,000","$7.03","33"
72,"digital marketing agency nyc","1,000","$7.38","37"
73,"digital marketing agency uae","1,000","$2.66","41"
74,"social media marketing agency near me","1,000","$5.38","11"
75,"social media marketing basics","1,000","$2.92","30"
76,"social media marketing class","1,000","$9.43","54"
77,"social media marketing hashtags","1,000","$2.15","9"
78,"social media marketing jobs remote","1,000","$1.87","22"
79,"social media marketing online","1,000","$3.94","32"
80,"social media campaigns successful","1,000","$2.84","18"
81,"social media marketing skills","1,000","$2.48","16"
82,"digital marketing agency brisbane","880","$7.59","35"
83,"digital marketing agency birmingham","880","$5.51","30"
84,"digital marketing agency egypt","880","$0.80","23"
85,"digital marketing agency healthcare","880","$9.68","28"
86,"digital marketing agency lahore","880","$0.56","19"
87,"digital marketing agency startup","880","$6.44","30"
88,"social media marketing degree","880","$14.12","50"
89,"social media marketing guide","880","$3.62","22"
90,"social media marketing hubspot","880","$4.95","14"
91,"social media marketing news","880","$3.00","17"
92,"social media marketing videos","880","$6.36","16"
93,"social media marketing website","880","$3.44","46"
94,"social media marketing youtube","880","$4.69","23"
95,"digital marketing agency ads","720","$2.79","10"
96,"digital marketing agency abu dhabi","720","$2.98","30"
97,"digital marketing agency auckland","720","$4.65","42"
98,"digital marketing services companies","720","$4.00","23"
99,"digital marketing services provider","720","$1.82","22"
100,"digital marketing company new york","720","$4.52","37"
101,"social media marketing agency pricing","720","$3.31","44"
102,"social media marketing agency for small business","720","$9.01","34"
103,"social media marketing hindi","720","$26.03","2"
104,"social media marketing memes","720","$0.00","1"
105,"social media marketing methods","720","$3.15","9"
106,"social media marketing online course free","720","$1.91","49"
107,"social media marketing strategy template","720","$5.11","36"
108,"digital marketing agency dublin","590","$4.03","37"
109,"digital marketing agency houston","590","$8.36","27"
110,"digital marketing agency jobs","590","$1.74","37"
111,"digital marketing agency jakarta","590","$0.97","52"
112,"digital marketing agency lagos","590","$0.48","14"
113,"digital marketing services mumbai","590","$0.70","33"
114,"digital marketing agency south africa","590","$1.05","45"
115,"social media marketing activities","590","$1.41","13"
116,"social media marketing design","590","$4.33","11"
117,"social media marketing history","590","$1.00","2"
118,"social media marketing hiring","590","$6.45","45"
119,"social media marketing manager job description","590","$1.85","10"
120,"social media marketing manager salary","590","$2.15","3"
121,"social media campaign plan","590","$4.12","25"
122,"social media marketing strategy pdf","590","$1.75","31"
123,"social media marketing udemy","590","$1.57","36"
124,"social media marketing uk","590","$6.14","46"
125,"digital marketing services in uk","480","$2.45","46"
126,"digital marketing agency goa","480","$0.62","10"
127,"digital marketing agency johannesburg","480","$1.32","28"
128,"digital marketing services london","480","$3.21","30"
129,"digital marketing agency orange county","480","$10.34","23"
130,"digital marketing agency orlando","480","$6.73","22"
131,"digital marketing services pune","480","$0.56","27"
132,"digital marketing agency qatar","480","$1.82","46"
133,"digital marketing agency saudi arabia","480","$2.03","28"
134,"digital marketing agency vadodara","480","$0.53","10"
135,"digital marketing agency website template","480","$1.05","39"
136,"social media marketing degree online","480","$33.56","48"
137,"social media marketing london","480","$8.34","32"
138,"social media marketing metrics","480","$1.53","13"
139,"social media marketing questions","480","$1.57","6"
140,"social media marketing quotation","480","$1.81","19"
141,"social media marketing services list","480","$2.42","26"
142,"social media marketing workshop","480","$4.06","54"
143,"social media marketing work","480","$2.29","28"
144,"digital marketing agency cape town","390","$1.08","35"
145,"digital marketing agency dhaka","390","$0.26","23"
146,"digital marketing agency gold coast","390","$6.93","34"
147,"digital marketing agency hong kong","390","$6.89","59"
148,"digital marketing agency kenya","390","$0.56","21"
149,"digital marketing agency montreal","390","$4.77","32"
150,"digital marketing agency wordpress theme","390","$0.82","38"
151,"social media marketing apprenticeship","390","$1.63","41"
152,"social media marketing jobs work from home","390","$0.11","42"
153,"social media marketing jobs salary","390","$1.01","9"
154,"social media marketing jobs entry level","390","$3.82","19"
155,"social media marketing linkedin","390","$12.80","28"
156,"social media marketing overview","390","$1.58","16"
157,"social media marketing usa","390","$3.31","50"
158,"social media marketing updates","390","$2.26","24"
159,"social media marketing wikipedia","390","$0.99","3"
160,"digital marketing agency edinburgh","320","$3.09","30"
161,"digital marketing company list","320","$2.28","22"
162,"digital marketing agency name generator","320","$0.77","25"
163,"digital marketing company website","320","$0.73","40"
164,"social media marketing agency names","320","$1.50","26"
165,"social media marketing assistant","320","$5.35","30"
166,"social media marketing kya hai","320","$0.46","5"
167,"social media marketing keywords","320","$1.79","12"
168,"social media marketing questionnaire pdf","320","$2.75","2"
169,"social media marketing vancouver","320","$7.05","41"
170,"digital marketing agency business plan pdf","260","$1.18","37"
171,"digital marketing agency chandigarh","260","$0.66","13"
172,"digital marketing agency website design","260","$1.78","26"
173,"digital marketing agency kuwait","260","$1.56","37"
174,"digital marketing agency list","260","$3.41","25"
175,"digital marketing agency meaning","260","$0.44","6"
176,"social media marketing 2023","260","$3.58","31"
177,"social media campaign design","260","$2.83","10"
178,"social media marketing essay","260","$1.26","4"
179,"social media marketing intern job description","260","$1.11","20"
180,"social media marketing online jobs","260","$0.67","47"
181,"social media marketing questionnaire for students","260","$1.58","2"
182,"digital marketing services poster","210","$7.07","5"
183,"digital marketing agency course","210","$2.27","54"
184,"digital marketing agency description","210","$0.69","20"
185,"digital marketing agency essex","210","$9.93","34"
186,"digital marketing agency for sale","210","$5.07","52"
187,"digital marketing agency kuala lumpur","210","$2.44","44"
188,"digital marketing agency kerala","210","$0.62","16"
189,"digital marketing company names in india","210","$1.49","24"
190,"digital marketing agency quotes","210","$1.95","20"
191,"digital marketing agency structure","210","$2.94","6"
192,"digital marketing agency template","210","$1.69","37"
193,"digital marketing agency thane","210","$0.74","26"
194,"social media marketing definition by authors","210","$3.95","3"
195,"social media marketing jobs for freshers","210","$0.07","28"
196,"social media marketing journal","210","$1.92","10"
197,"social media marketing ki","210","$2.45","9"
198,"social media marketing literature review","210","$1.43","6"
199,"social media marketing mix","210","$2.13","7"
200,"social media campaign proposal","210","$5.06","17"
201,"social media campaign plan template","210","$4.07","28"
202,"social media marketing upwork","210","$5.28","14"
203,"social media marketing vector","210","$4.50","2"
204,"social media marketing webinars","210","$4.57","47"
205,"digital marketing services description","170","$2.39","23"
206,"digital marketing agency business model","170","$2.75","28"
207,"digital marketing services in indore","170","$3.12","8"
208,"digital marketing services in chandigarh","170","$1.54","11"
209,"digital marketing agency japan","170","$2.46","48"
210,"digital marketing agency reviews","170","$3.08","20"
211,"digital marketing agency rawalpindi","170","$0.46","16"
212,"digital marketing agency social media posts","170","$2.98","13"
213,"digital marketing services toronto","170","$6.56","28"
214,"digital marketing agency theme","170","$0.51","23"
215,"social media marketing 2022","170","$4.46","33"
216,"social media marketing books pdf free download","170","$0.89","20"
217,"social media campaign cost","170","$3.42","28"
218,"social media marketing executive job description","170","$0.33","6"
219,"social media marketing hubspot answers","170","$0.00","1"
220,"social media marketing internship work from home","170","$0.14","27"
221,"social media marketing jobs in dubai","170","$0.40","25"
222,"social media marketing job description resume","170","$0.72","4"
223,"social media marketing jobs london","170","$1.10","28"
224,"social media marketing manager jobs","170","$1.96","19"
225,"social media campaign objectives","170","$2.38","6"
226,"social media campaign poster","170","$0.00","3"
227,"social media campaign report","170","$4.88","26"
228,"social media marketing university","170","$5.29","25"
229,"digital marketing services packages","140","$1.34","37"
230,"digital marketing services websites","140","$0.76","49"
231,"digital marketing services ahmedabad","140","$0.71","26"
232,"digital marketing services banner","140","$0.00","1"
233,"digital marketing agency bandung","140","$0.39","48"
234,"digital marketing services chennai","140","$0.50","30"
235,"digital marketing services canada","140","$2.73","59"
236,"digital marketing agency edmonton","140","$9.54","28"
237,"digital marketing agency germany","140","$5.85","55"
238,"digital marketing agency landing page","140","$2.28","34"
239,"digital marketing services melbourne","140","$6.81","34"
240,"digital marketing company mohali","140","$0.71","13"
241,"digital marketing agency organizational structure","140","$3.66","10"
242,"digital marketing agency reddit","140","$17.52","21"
243,"digital marketing company salary","140","$2.21","9"
244,"digital marketing agency salary","140","$2.81","5"
245,"help your needs digital marketing services","140","$0.00","21"
246,"digital marketing agency new zealand","140","$3.21","39"
247,"social media campaigns for social change","140","$0.96","3"
248,"social media marketing agency how to start","140","$2.48","51"
249,"social media campaign budget","140","$2.52","24"
250,"social media campaigns definition","140","$0.00","1"
251,"social media marketing goals must be flexible because","140","$0.00","1"
252,"social media marketing kenya","140","$0.98","17"
253,"social media marketing major","140","$10.59","32"
254,"social media marketing notes pdf","140","$0.29","5"
255,"digital marketing agency description sample","110","$0.77","27"
256,"digital marketing agency faisalabad","110","$0.21","7"
257,"digital marketing agency guwahati","110","$0.41","20"
258,"digital marketing services kolkata","110","$1.07","21"
259,"digital marketing agency manila","110","$0.79","42"
260,"digital marketing agency multan","110","$0.40","4"
261,"digital marketing services new york","110","$5.28","15"
262,"digital marketing services proposal","110","$2.62","25"
263,"digital marketing company reviews","110","$10.67","17"
264,"digital marketing agency rajkot","110","$0.31","18"
265,"digital marketing services singapore","110","$4.76","55"
266,"digital marketing agency visiting card","110","$0.00","1"
267,"digital marketing agency video","110","$1.08","14"
268,"digital marketing agency vietnam","110","$2.74","43"
269,"social media marketing bio examples","110","$2.67","6"
270,"social media marketing dissertation topics","110","$0.00","1"
271,"social media marketing how to start","110","$2.24","40"
272,"social media marketing interview questions and answers pdf","110","$0.00","2"
273,"social media marketing job titles","110","$0.00","2"
274,"social media marketing jobs no experience","110","$2.11","41"
275,"social media marketing lead generation","110","$4.54","24"
276,"social media marketing mcq","110","$0.00","2"
277,"social media marketing notes","110","$5.02","13"
278,"social media marketing niches","110","$2.25","20"
279,"social media marketing questionnaire for owners","110","$0.00","5"
280,"social media marketing questions and answers","110","$1.41","5"
281,"social media marketing quiz","110","$2.31","13"
282,"social media marketing virtual assistant","110","$11.77","32"
283,"social media marketing workbook","110","$3.13","90"
284,"social media marketing website template","110","$2.02","48"
285,"digital marketing services agreement","90","$6.57","45"
286,"digital marketing agency content ideas","90","$0.77","23"
287,"digital marketing agency definition","90","$4.36","5"
288,"digital marketing agency dehradun","90","$0.43","19"
289,"digital marketing agency europe","90","$2.72","48"
290,"digital marketing agency ghaziabad","90","$0.62","24"
291,"digital marketing agency greece","90","$3.47","36"
292,"digital marketing agency how to start","90","$2.14","35"
293,"digital marketing agency hiring","90","$3.87","36"
294,"digital marketing agency jeddah","90","$1.88","41"
295,"digital marketing agency jobs london","90","$1.97","34"
296,"digital marketing agency kathmandu","90","$0.53","6"
297,"digital marketing agency kanpur","90","$0.37","12"
298,"digital marketing agency owner salary","90","$0.00","5"
299,"digital marketing agency organizational chart","90","$8.22","10"
300,"digital marketing services philippines","90","$1.33","18"
301,"digital marketing agency revenue","90","$3.29","9"
302,"digital marketing agency team structure","90","$5.97","9"
303,"digital marketing agency trivandrum","90","$0.47","21"
304,"digital marketing agency website template free download","90","$1.22","31"
305,"digital marketing agency workflow","90","$11.35","11"
306,"digital marketing agency in zirakpur","90","$0.28","3"
307,"social media campaign brief","90","$4.92","20"
308,"social media campaign case study","90","$2.33","6"
309,"social media campaign calendar","90","$6.83","30"
310,"social media campaigns for restaurants","90","$3.05","20"
311,"social media campaigns for nonprofits","90","$6.46","31"
312,"social media marketing google scholar","90","$2.11","12"
313,"social media marketing gig description","90","$1.58","12"
314,"social media marketing google course","90","$1.50","40"
315,"social media marketing hsn code","90","$0.00","1"
316,"social media campaign kpis","90","$1.54","21"
317,"social media marketing logo ideas","90","$1.25","4"
318,"social media marketing manager resume","90","$1.02","7"
319,"social media marketing meaning in hindi","90","$0.00","1"
320,"social media marketing qualifications","90","$2.84","42"
321,"social media marketing quotation pdf","90","$1.07","24"
322,"social media marketing quotation template","90","$3.57","27"
323,"social media campaign timeline","90","$4.11","7"
324,"social media campaign tools","90","$4.49","23"
325,"social media marketing work from home","90","$0.48","45"
326,"digital marketing services for restaurants","70","$2.14","22"
327,"digital marketing services for real estate","70","$4.79","19"
328,"digital marketing services for startups","70","$4.85","24"
329,"digital marketing numbers","70","$3.01","35"
330,"digital marketing services agreement template","70","$6.86","43"
331,"digital marketing agency about us sample","70","$1.30","41"
332,"digital marketing company about us","70","$0.56","41"
333,"digital marketing agency bio","70","$0.75","20"
334,"digital marketing services content","70","$0.42","28"
335,"digital marketing services coimbatore","70","$1.29","21"
336,"digital marketing agency captions for instagram","70","$0.84","15"
337,"digital marketing agency pitch deck","70","$2.19","44"
338,"digital marketing company examples","70","$3.08","21"
339,"digital marketing agency franchise","70","$6.81","60"
340,"digital marketing agency hierarchy","70","$2.21","7"
341,"digital marketing services in nagpur","70","$1.21","18"
342,"digital marketing services in surat","70","$0.21","7"
343,"digital marketing services in vadodara","70","$0.56","18"
344,"digital marketing services jaipur","70","$0.95","21"
345,"digital marketing company jobs","70","$0.18","35"
346,"digital marketing services meaning","70","$1.62","11"
347,"digital marketing services malaysia","70","$3.00","45"
348,"internet marketing services meaning","70","$2.24","3"
349,"digital marketing agency ottawa","70","$9.02","47"
350,"digital marketing agency ontario","70","$5.08","31"
351,"digital marketing services png","70","$2.75","3"
352,"digital marketing services pdf","70","$1.20","45"
353,"digital marketing agency remote jobs","70","$1.91","59"
354,"digital marketing agency revenue model","70","$5.53","18"
355,"digital marketing agency rate card pdf","70","$2.30","32"
356,"digital marketing agency roles","70","$2.93","28"
357,"digital marketing company udaipur","70","$0.52","12"
358,"digital marketing agency wordpress theme free","70","$0.50","28"
359,"digital marketing agency york","70","$4.44","10"
360,"digital marketing company in yamunanagar","70","$1.79","11"
361,"digital marketing company zirakpur","70","$0.85","5"
362,"social media campaign budget example","70","$2.35","13"
363,"social media campaign cost breakdown","70","$3.65","22"
364,"social media marketing hourly rate","70","$3.09","20"
365,"social media marketing keywords list","70","$4.76","8"
366,"social media marketing karachi","70","$1.31","14"
367,"social media marketing list","70","$1.70","20"
368,"social media campaign objectives examples","70","$2.17","10"
369,"social media marketing opportunities","70","$2.23","22"
370,"social media campaign pdf","70","$0.00","8"
371,"social media campaign ppt","70","$2.57","10"
372,"social media marketing quiz with answers","70","$0.00","3"
373,"social media marketing vacancy","70","$0.59","17"
374,"social media marketing whatsapp group","70","$0.64","12"
375,"social media marketing ziele","70","$1.62","21"
376,"360 branding solutions","70","$0.00","1"
377,"web branding info solutions","70","$0.00","2"
378,"digital marketing services logo","50","$0.00","1"
379,"digital marketing services email template","50","$1.64","27"
380,"digital marketing services brochure","50","$2.41","23"
381,"digital marketing services cost","50","$3.19","28"
382,"digital marketing agency dma","50","$10.22","8"
383,"digital marketing company dehradun","50","$0.71","13"
384,"digital marketing services faqs","50","$2.94","14"
385,"digital marketing agency google ads","50","$18.31","31"
386,"digital marketing services includes","50","$2.09","23"
387,"digital marketing services icon","50","$0.00","1"
388,"digital marketing agency jobs near me","50","$1.72","48"
389,"digital marketing agency johor bahru","50","$2.20","17"
390,"digital marketing agency kannur","50","$0.96","5"
391,"digital marketing agency market size","50","$4.96","13"
392,"digital marketing services online","50","$2.74","31"
393,"digital marketing agency owner","50","$3.48","10"
394,"digital marketing services quotation","50","$1.22","16"
395,"digital marketing services sac code","50","$0.00","1"
396,"digital marketing company stocks in india","50","$1.24","2"
397,"digital marketing company startup","50","$5.00","44"
398,"digital marketing services template","50","$1.38","12"
399,"digital marketing agency theme free","50","$0.68","19"
400,"digital marketing agency udaipur","50","$0.52","17"
401,"digital marketing services in udaipur","50","$4.49","5"
402,"digital marketing agency vision and mission","50","$1.30","19"
403,"digital marketing agency website template wordpress free download","50","$1.40","38"
404,"digital marketing agency yorkshire","50","$3.67","25"
405,"social media campaigns in india","50","$1.11","11"
406,"social media campaigns that went viral","50","$0.00","1"
407,"best social media campaigns 2021","50","$0.00","5"
408,"social media marketing kya hota hai","50","$21.33","13"
409,"social media marketing kaise kare","50","$34.78","28"
410,"social media marketing kit","50","$3.88","96"
411,"social media campaign presentation example","50","$2.45","13"
412,"social media campaign posts","50","$1.79","8"
413,"social media marketing quizlet","50","$0.00","5"
414,"social media marketing upwork profile","50","$3.75","5"
415,"social media marketing youtube channels","50","$3.68","17"
416,"social media marketing zara","50","$2.30","12"
417,"social media marketing zitate","50","$2.04","11"
418,"online branding meaning","50","$0.00","1"
419,"digital channels in digital marketing","40","$1.77","11"
420,"digital marketing services for ecommerce","40","$6.67","27"
421,"digital marketing services agreement pdf","40","$7.23","20"
422,"digital marketing services brochure pdf","40","$1.71","27"
423,"digital marketing services business","40","$3.63","27"
424,"digital marketing agency job description","40","$1.57","11"
425,"digital marketing agency kaise khole","40","$0.22","16"
426,"digital marketing agency offers","40","$1.47","35"
427,"digital marketing services ppt","40","$1.43","26"
428,"online marketing services uk","40","$0.00","7"
429,"digital marketing agency valuation multiples","40","$6.20","28"
430,"digital marketing agency vashi","40","$0.79","27"
431,"digital marketing agency vizag","40","$0.55","19"
432,"digital marketing agency website template html","40","$0.91","25"
433,"digital marketing company what is it","40","$2.30","33"
434,"digital marketing agency wikipedia","40","$0.00","6"
435,"digital marketing agency zurich","40","$6.10","49"
436,"social media marketing 101 pdf","40","$2.63","16"
